<?xml version="1.0" encoding="UTF-8"?>

<!ELEMENT CDCatlogs (CD)+>
<!ELEMENT CD (title,Artist+,Compony?,price)>
<!ELEMENT title (#PCDATA)>
<!ELEMENT Artist (#PCDATA)>
<!ELEMENT Compony (#PCDATA)>
<!ELEMENT price (#PCDATA)>


<!ATTLIST CD lang (Hindi|English|Marathi) #REQUIRED>

